,Number of Vote,Date of Votes,eng,ger,fre,ita,spa,por,jpn,chi,rus,ara
347,274,25/09/1977,"""Decriminalising abortion""",Volksinitiative 'für die Fristenlösung',Initiative populaire fédérale «Pour la solution du délai»,Iniziativa popolare 'per la soluzione dei termini',Iniciativa popular federal «Por una solución de los plazos»,"Iniciativa popular ""Descriminalização do aborto""",イニシアチブ「中絶可能期間の導入を」,公民动议《堕胎去罪化》,"Народная законодательная инициатива ""О сроках прерывания беременности"".","المبادرة الشعبية ""من أجل عدم تجريم الإجهاض"" (من أجل فترة معينة يُسمح قبلها بالإجهاض)"
346,273,25/09/1977,Raising the number of signatures required for initiatives (Constitutional articles 120 and 121),Bundesbeschluss vom 25.03.1977 über die Erhöhung der Unterschriftenzahl für die Verfassungsinitiative (Art. 120 und 121 BV),Arrêté fédéral relevant le nombre de signatures requis pour l'initiative constitutionnelle,Decreto federale del 25.03.1977 sull'aumento del numero di firme richiesto per l'iniziativa costituzionale (Art. 120 e 121 Cost.),Decreto federal del 25.03.1977 sobre el aumento del número de firmas requeridas para la iniciativa constitucional (art. 120 y 121 Const.),Resolução federal sobre o aumento do número de assinaturas necessárias para uma iniciativa constitucional (artigos 120 e 121 da Constituição Federal),憲法イニシアチブの必要署名数引上げに関する１９７７年３月２５日の連邦決議（連邦憲法１２０条および１２１条）,关于增加宪法性动议所需签名数量的联邦法令(联邦宪法第120和121条),"Решение парламента от 25.03.1977 г. ""Об увеличении числа подписей граждан, необходимых для запуска народной законодательной инициативы по внесению изменений в Конституцию (Ст. 120 и Ст. 121 федеральной конституции).",المرسوم الفدرالي ل 25 مارس 1977 بشأن زيادة عدد التوقيعات اللازمة للمبادرة الدستورية (المادتان 120 و 121 من الدستور الفدرالي)
345,272,25/09/1977,Raising the number of signatures required for referendums (Constitutional articles 89 and 89),Bundesbeschluss vom 25.03.1977 über die Erhöhung der Unterschriftenzahl für das Referendum (Art. 89 und 89bis BV),Arrêté fédéral relevant le nombre de signatures requis pour le référendum,Decreto federale del 25 marzo 1977 sull'aumento del numero di firme richiesto per il referendum (Art. 89 e 89bis Cost.),Decreto federal del 25.03.1977 sobre el aumento del número de firmas requeridas para el referéndum (art. 89 y 89bis Const.),Resolução federal para aumentar o número de assinaturas necessárias para que haja referendo (artigos 89 e 89 da Constituição Federal),レファレンダムの必要署名数引上げに関する１９７７年３月２５日の連邦決議,关于增加公民复决所需签名数量的联邦法令(联邦宪法第89和89乙条款),"Решение парламента от 25.03.1977 г. ""Об увеличении числа подписей граждан, необходимых для запуска народной законодательной инициативы"" (Ст. 89 и Ст. 89bis федеральной конституции).",المرسوم الفدرالي ل 25 مارس 1977 بشأن زيادة عدد التوقيعات اللازمة للإستفتاء الشعبي (المادة 89 والنسخة الثانية للمادة 89 من الدستور الفدرالي)
344,271,25/09/1977,"""Against air pollution by motor vehicles (Albatross initiative)""",Volksinitiative 'gegen die Luftverschmutzung durch Motorfahrzeuge',Initiative populaire fédérales «Contre la pollution atmosphérique causée par les véhicules à moteur»,Iniziativa popolare 'contro l'inquinamento atmosferico cagionato dai veicoli a motore',Iniciativa popular federal «Contra la contaminación atmosférica causada por los vehículos motorizados»,"Iniciativa popular ""Contra a poluição do ar por veículos motores""",イニシアチブ「自動車両による大気汚染に反対」,公民动议《反对机动车辆造成的空气污染(信天翁动议)》,"Народная законодательная инициатива ''Против загрязнения воздуха моторизованными средствами передвижения"".","المبادرة الشعبية ""ضد تلوث الهواء الناتج عن المركبات الآلية"""
343,270,25/09/1977,Constitutional amendment on effective protection of tenants,Bundesbeschluss vom 25.03.1977 über die Volksinitiative 'für einen wirksamen Mieterschutz',Arrêté fédéral concernant l'initiative populaire fédérale «Pour une protection efficace des locataires»,Decreto federale del 25.03.1977 concernente l'iniziativa popolare 'per un'efficace protezione dei locatari',Decreto federal del 25.03.1977 sobre la iniciativa popular «Por una protección eficaz de los inquilinos»,"Iniciativa popular ""Pela proteção efetiva dos inquilinos""",イニシアチブ「効果的な賃借人保護を」に関する１９７７年３月２５日の連邦決議,公民动议《要求有效保护租房》,"Решение парламента от 25.03.1977 г. ""О Народной законодательной инициативе ""Об эффективной защите прав арендаторов жилья"".","المرسوم الفدرالي لـ 25 مارس 1977 بشأن المبادرة الشعبية ""من أجل حماية فعالة للمستأجرين"""
342,278,04/12/1977,Measures to balance the national budget,Bundesgesetz vom 05.05.1977 über Massnahmen zum Ausgleich des Bundeshaushaltes,Loi fédérale instituant des mesures propres à équilibrer les finances fédérales,Legge federale del 05.05.1977 su provvedimenti per equilibrare le finanze federali,Ley federal del 05.05.1977 sobre medidas para equilibrar las finanzas federales,Lei federal sobre medidas que equilibrem o orçamento nacional,１９７７年５月５日議決の連邦財政調整対策に関する連邦法,关于平衡国家预算措施的联邦法,"ФЗ от 05.05.1977 ""О мерах по оздоровлению федерального бюджета"".",القانون الفدرالي لـ 5 مايو 1977 بشأن التدابير اللازمة لموازنة الميزانية الفدرالية
341,277,04/12/1977,Introduction of civilian service as an alternative to military service,Bundesbeschluss vom 05.05.1977 über die Einführung eines zivilen Ersatzdienstes,Arrêté fédéral sur l'introduction d'un service civil de remplacement,Decreto federale del 05.05.1977 sull'introduzione di un servizio civile sostitutivo,Decreto federal del 05.05.1977 sobre la introducción del servicio civil sustitutivo,Resolução federal pela introdução de um serviço civil como alternativa para o serviço militar,１９７７年５月５日の社会的代替役務導入に関する連邦決議,关于将民防作为兵役替代方式的联邦法令,"Решение парламента от 05.05.1977 г. ""О введении альтернативной гражданской службы""",المرسوم الفدرالي لـ 5 مايو 1977 بشأن إدخال نظام الخدمة المدنية (كبديل للخدمة العسكرية)
340,276,04/12/1977,Law on political rights,Bundesgesetz vom 17.12.1976 über die politischen Rechte,Loi fédérale sur les droits politiques,Legge federale del 17.12.1976 sui diritti politici,Ley federal del 17.12.1976 sobre los derechos políticos,Lei federal sobre direitos políticos,１９７６年１２月１７日議決の政治的権利に関する連邦法,关于政治权利的联邦法,"ФЗ от 17.12.1976 ""О политических правах"".",القانون الفدرالي لـ 17 ديسمبر 1976 بشأن الحقوق السياسية
339,275,04/12/1977,"""Higher taxes on big incomes""",Volksbegehren 'zur Steuerharmonisierung  zur stärkeren Besteuerung des Reichtums und zur Entlastung der unteren Einkommen (Reichtumsteuer-Initiative)',Initiative populaire fédérale «En vue de l'harmonisation fiscale d'une imposition plus forte de la richesse et du dégrèvement des bas revenus» (Initiative pour l'impôt sur la richesse),Iniziativa popolare 'per l'armonizzazione fiscale per una più forte imposizione della ricchezza e per lo sgravio dei redditi bassi (Iniziativa per un'imposta sulla ricchezza)',"Iniciativa popular federal «Por la armonización fiscal, una imposición más alta de los ricos y una desgravación de las rentas bajas (Iniciativa por impuestos sobre la riqueza)»","Iniciativa popular ""Equilíbrio dos impostos: por impostos mais altos sobre a riqueza e pela diminuição do imposto para salários menores""",国民発案「税金調整、富裕層の課税強化、低収入層の負担軽減を」（富裕税イニシアチブ）,公民动议《提高高收入者税率》,"Народная законодательная инициатива ""О гармонизации налоговой нагрузки, о налогообложении состояний и капиталов и о защите малообеспеченных слоев общества"".","المبادرة الشعبية ""من أجل تنسيق ضريبي وفرض ضرائب أعلى على الثروة والتخفيف من ضرائب ذوي الدخل المنخفض"" (مبادرة الضريبة على الثروة)"
338,282,26/02/1978,Constitutional article on economic policy,Bundesbeschluss vom 07.10.1977 über den Konjunkturartikel der Bundesverfassung,Arrêté fédéral concernant l'article conjoncturel de la constitution,Decreto federale del 07.10.1977 concernente l'articolo congiunturale della costituzione,Decreto federal del 07.10.1977 sobre el artículo coyuntural de la Constitución federal,Resolução federal sobre o artigo da Constituição Federal que reje a política econômica,連邦憲法の景気条項に関する１９７７年１０月７日の連邦決議,关于联邦宪法经济政策条款的联邦法令,"Решение парламента от 07.10.1977 г. ""О редакции статьи конституции, трактующей меры по поддержке национальной промышленной конъюнктуры"".",المرسوم الفدرالي لـ 7 أكتوبر 1977 بشأن المادة المتعلقة بالاقتصاد في الدستور الفدرالي
337,281,26/02/1978,"""Lowering retirement age""",Volksinitiative 'zur Herabsetzung des AHV-Alters',Initiative populaire fédérale «Visant à abaisser l'âge donnant droit aux prestations de l'AVS»,Iniziativa popolare 'per la diminuzione dell'età conferente il diritto alle prestazioni AVS',Iniciativa popular federal «Por la rebaja de la edad de jubilación»,"Iniciativa popular ""Redução da idade de aposentadoria""",イニシアチブ「定年年齢の引き下げを」,公民动议《降低退休年龄》,"Народная законодательная инициатива ""О снижении пенсионного возраста"".","المبادرة الشعبية ""من أجل خفض سن التقاعد"""
336,280,26/02/1978,"Law on old age- , widows- and orphans insurance (9th revision)",Bundesgesetz über die Alters- und Hinterlassenenversicherung  Aenderung vom 24.06.1977 (9. AHV-Revision),Modification de la loi fédérale sur l'assurance-vieillesse et survivants (9e revision de l'AVS),Legge federale sull'assicurazione per la vecchiaia e per i superstiti Modificazione del 24.06.1977 (Nona revisione dell'AVS),Ley federal sobre el seguro de vejez y supervivientes (9a revisión del SVS) (Modificación del 24.06.1977),"Lei federal sobre a previdência de idosos, viúvos/as e órfãos. Emenda de 24.06.1977 (9a. revisão)",老齢・遺族年金に関する連邦法、１９７７年６月２４日改正（第９次老齢・遺族年金制度改正）,关于养老遗属保险的联邦法修正案(第九次修订),"ФЗ ""О реформе системы государственного пенсионного обеспечения с изменениями от 24.06.1977 г. (9. AHV-Revision)"".",القانون الفدرالي لـ 24 يونيو 1977 بشأن تعديل التأمين على الشيخوخة والباقين على قيد الحياة (المراجعة 9)
335,279,26/02/1978,"""Democracy in construction of motorways""",Volksinitiative 'Demokratie im Nationalstrassenbau',Initiative populaire fédérales «Démocratie dans la construction des routes nationales»,Iniziativa popolare 'Democrazia nella costruzione delle strade nazionali',Iniciativa popular federal «Democracia en la construcción de carreteras nacionales»,"Iniciativa popular ""Mais democracia direta nas construções das autoestradas nacionais""",イニシアチブ「国道建設に民主主義を」,公民动议《加强高速公路建设事务决策中议会与人民的参与》,"Народная законодательная инициатива ""Демократия в области строительства национальных дорог"".","المبادرة الشعبية ""تعزيز المشاركة البرلمانية والشعبية في عملية صنع القرار المتعلقة بانشاء الطرق السريعة"""
334,287,28/05/1978,"""Twelve Sundays a year without motor traffic""",Volksinitiative 'Für 12 motorfahrzeugfreie und motorflugzeugfreie Sonntage pro Jahr',Initiative populaire fédérales «Pour douze dimanches par année sans véhicules à moteur ni avions»,Iniziativa popolare 'per dodici domeniche annuali senza veicoli e aerei a motore',Iniciativa popular federal «Por doce domingos al año sin vehículos y aviones motorizados»,"Iniciativa popular ""Doze domingos por ano livre do tráfego de automóveis""",イニシアチブ「年間１２日の自動車両・エンジン飛行機使用禁止日を」,公民动议《每年12个周日无机动车辆交通》,"Народная законодательная инициатива ""О введении 12-ти дней в году без авто- и авиадвижения"".","المبادرة الشعبية ""12 يوم أحد في السنة دون مركبات أو طائرات بمحركات"""
333,286,28/05/1978,Law on funding for higher education and research,Bundesgesetz vom 07.10.1977 über die Förderung der Hochschulen und die Forschung (HFG),Loi fédérale sur l'aide aux hautes écoles et la recherche (LHR),Legge federale del 07.10.1977 sull'aiuto alle università e la ricerca (LAUR),Ley federal del 07.10.1977 sobre las ayudas a las universidades y a la investigación (LFUI),Lei federal sobre o financiamento do ensino universitário e da pesquisa,１９７７年１０月７日議決の大学教育と研究の促進に関する連邦法,关于资助高等教育与科研的联邦法,"ФЗ от 07.10.1977 г. ""О поддержке развития вузов и вузовской науки (HFG)"".",القانون الفدرالي لـ 7 أكتوبر 1977 بشأن تمويل التعليم العالي والبحث العلمي
332,285,28/05/1978,Law on protection of pregnancy and abortion as a punishable offence,Bundesgesetz vom 24.06.1977 über den Schutz der Schwangerschaft und die Strafbarkeit des Schwangerschaftsabbruchs,Loi fédérale sur la protection de la grossesse et le caractère punissable de son interruption,Legge federale del 24.06.1977 sulla protezione della gravidanza e la punibilità dell'aborto,Ley federal del 24.06.1977 sobre la protección del embarazo y la penalidad del aborto,Lei federal sobre a proteção da gravidez e a punibilidade da prática do aborto,１９７７年６月２４日議決の妊婦の保護および妊娠中絶の違法性に関する連邦法,关于保护妊娠和堕胎违法的联邦法,"ФЗ от 24.06.1977 г. ""О защите беременности и наказуемости прерывания беременности"".",القانون الفدرالي لـ 24 يونيو 1977 بشأن حماية الحمل وتجريم الإجهاض
331,284,28/05/1978,Amended law on customs duties,Zolltarifgesetz  Aenderung vom 07.10.1977,Modification de la loi sur le tarif des douanes,Legge federale sulla tariffa delle dogane svizzere Modificazione del 07.10.1977,Ley federal sobre las tarifas aduaneras (Modificación del 07.10.1977),"Lei sobre tarifas alfandegárias, emenda de 07.10.1977",関税率法、１９７７年１０月７日改正,关税法修正案,"""ФЗ О таможенных тарифах"" с изменениями от 07.10.1977 г.",قانون تعديل الرسوم الجمركية لـ 7 أكتوبر 1977
330,283,28/05/1978,Law on summer time,Zeitgesetz vom 24.06.1977,Loi fédérale réglementant l'heure en Suisse,Legge federale del 24.06.1977 sull'ora,Ley federal del 24.06.1977 sobre el régimen horario en Suiza,Lei sobre o horário de verão,１９７７年６月２４日議決の限時法,夏时制法,Временный закон от 24.06.1977 г.,القانون الفدرالي لـ 24 يونيو 1977 بشأن التوقيت الصيفي
329,288,24/09/1978,Creation of canton Jura (Articles 1 and 80 of the constitution),Bundesbeschluss vom 09.03.1978 über die Gründung des Kantons Jura,Arrêté fédéral sur la création du canton du Jura,Decreto federale del 09.03.1978 sulla creazione del Cantone del Giura,Decreto federal del 09.03.1978 sobre la fundación del Cantón del Jurá,Resolução federal sobre a criação do cantão do Jura (artigos 1 e 80 da Constituição Federal),１９７８年３月９日のジュラ州創設に関する連邦決議,关于创建汝拉州的联邦法令(联邦宪法第1和80条),"Решение парламента от 09.03.1978 ""Об образовании кантона Юра"".","المرسوم الفدرالي لـ 9 مارس 1978 بشأن إنشاء كانتون ""جورا"" (المادتين 1 و 80 من الدستور الفدرالي)"
328,292,03/12/1978,Law on professional education,Bundesgesetz vom 19.04.1978 über die Berufsbildung (BBG),Loi fédérale sur la formation professionnelle (LFPr),Legge federale del 19.04.1978 sulla formazione professionale (LFP),Ley federal del 19.04.1978 sobre la formación profesional (LFPr),Lei federal sobre formação profissional,１９７８年４月１９日議決の職業教育に関する連邦法,关于职业教育的联邦法,"ФЗ от 19.04.1978 ""О профессиональном образовании"" (BBG).",القانون الفدرالي لـ 19 أبريل 1978 بشأن التكوين المهني
327,291,03/12/1978,Law on obligation to provide security police,Bundesgesetz vom 09.03.1978 über die Erfüllung sicherheitspolizeilicher Aufgaben des Bundes,Loi fédérale sur l'accomplissement des tâches de la Confédération en matière de police de sécurité,Legge federale del 09.03.1978 sull'adempimento dei compiti della Confederazione in materia di polizia di sicurezza,Ley federal del 09.03.1978 sobre el cumplimiento de las tareas de la Confederación en el ámbito de la policía de seguridad,Lei federal sobre a obrigação do governo federal de garantir serviços de segurança da polícia,１９７８年３月９日議決の連邦治安警察の任務履行に関する連邦法,关于联邦义务提供保安警察的联邦法,"ФЗ от 09.03.1978 г. ""О порядке решения федеральным центром задач, связанных с обеспечением безопасности государства"".",القانون الفدرالي لـ 9 مارس 1978 بشأن تحقيق الكنفدرالية لواجبها في مجال توفير شرطة الأمن
326,290,03/12/1978,Law on protection of animals,Tierschutzgesetz (TschG) vom 09.03.1978,Loi fédérale sur la protection des animaux (LPA),Legge federale del 09.03.1978 sulla protezione degli animali (LPDA),Ley federal del 09.03.1978 sobre la protección de los animlaes (LPA),Lei federal de proteção dos animais,１９７８年３月９日議決の動物保護法,关于动物保护的联邦法,Закон об охране животных (TschG) от 09.03.1978 г.,القانون الفدرالي لـ9 مارس 1978 بشأن حماية الحيوانات
325,289,03/12/1978,Milk production,Milchwirtschaftsbeschluss 1977 (MWB 1977) vom 07.10.1977,Arrêté sur l'économie laitière 1977 (AEL 1977),Decreto sull'economia lattiera 1977 (DEL 1977) del 07.10.1977,Decreto sobre la economía lechera 1977 (DEL 1977) del 07.10.1977,Decreto 1977 sobre a provisão de leite,１９７７年１０月７日の酪農に関する連邦決議,牛奶供应法令,Решение парламента о развитии молочной промышленности 1977 (MWB 1977) от 07.10.1977 г.,المرسوم الفدرالي لـ 7 أكتوبر 1977 بشأن صناعة الألبان
324,296,18/02/1979,"""Maintaining and protecting the people's rights and security when building and operating nuclear plants""",Volksinitiative 'zur Wahrung der Volksrechte und der Sicherheit beim Bau und Betrieb von Atomanlagen',Initiative populaire fédérale «Pour la sauvegarde des droits populaires et de la sécutité lors de la constructions et de l'exploitation d'installations atomiques»,Iniziativa popolare 'per la salvaguardia dei diritti popolari e della sicurezza nella costruzione e nell'esercizio degli impianti nucleari',Iniciativa popular federal «Por la salvaguardia de los derechos populares y de la seguridad en la construcción y explotación de centrales nucleares»,"Iniciativa popular ""Pela manutenção dos direitos populares e da segurança durante a construção e operação de usinas nucleares""",イニシアチブ「国民の権利と原発の建設・運営における安全の維持を」,公民动议《建设运营核电站时应维持的保护人民权利与安全》,"Народная законодательная инициатива ""О правах народа и о безопасном строительстве и эксплуатации АЭС"".","المبادرة الشعبية ""الحفاظ على حقوق الشعب والسلامة عند بناء وتشغيل المحطات النووية"""
323,295,18/02/1979,"""Ban on alcohol and tobacco advertising""",Volksinitiative 'gegen Suchtmittelreklame',Initiative populaire fédérale «Contre la publicité pour des produits qui engendrent la dépendance»,Iniziativa popolare 'contro la pubblicità in favore dei prodotti che generano dipendenza',Iniciativa popular federal «Contra la publicidad de productos que crean adicción»,"Iniciativa popular ""Proibição de propaganda de produtos que geram dependência química (álcool e cigarro)""",イニシアチブ「依存性薬物の広告に反対」,公民动议《禁止烈性酒和烟草广告》,"Народная законодательная инициатива ""Против рекламы средств, вызывающих привыкание"".","المبادرة الشعبية ""ضد الإعلان عن المنتوجات المولدة للإدمان"""
322,294,18/02/1979,"Counter-proposal to people's initiative ""Promotion of footpaths and trails""",Bundesbeschluss vom 06.10.1978 über die Volksinitiative 'zur Förderung der Fuss- und Wanderwege' (Gegenentwurf),Arrêté fédéral concernant l'initiative populaire fédérales «Pour le développement des chemins et sentiers» (contre-projet),Decreto federale del 06.10.1978 sull'iniziativa popolare 'per l'incremento di sentieri e viottoli' (controprogetto),Decreto federal del 06.10.1978 sobre la iniciativa popular «Por el fomento de caminos y senderos» (contrapropuesta),"Contraproposta para a resolução federal sobre a iniciativa popular ""Pela criação de mais trilhas a pé""",イニシアチブ「遊歩道・ハイキングコースの整備促進を」に関する１９７８年１０月６日の連邦決議（対案）,对关于公民动议《推广人行小径与徒步路线》的联邦法令的反提案,"Решение парламента от 06.10.1978 г. ""О Народной законодательной инициативе ""Об охране и развитии туристических пеших маршрутов"" (контрпроект).","المرسوم الفدرالي لـ 6 أكتوبر 1978 بشأن المبادرة الشعبية ""من أجل تعزيز مسارات المشاة والمشي لمسافات طويلة"" (المقترح المضاد)"
