,Number of Vote,Date of Votes,eng,ger,fre,ita,spa,por,jpn,chi,rus,ara
475,150,29/01/1950,Extending amended measures to promote house ownership,Bundesbeschluss betreffend die Verlängerung der Geltungsdauer und die Abänderung des Bundesbeschlusses über Massnahmen zur Förderung der Wohnbautätigkeit,Arrêté fédéral prorogeant et modifiant celui qui concerne les mesures destinées à encourager la construction de maisons d'habitation,Decreto federale che proroga e modifica quello sulle misure intese a promuovere la costruzione di case d'abitazione,Decreto federal sobre la prórroga y modificación de otro relativo a las medidas para el fomento de la construcción de viviendas,Resolução federal que prorroga e modifica a resolução federal sobre medidas de fomento à construção de residências,住居建設促進対策の有効期間延長と同対策に関する連邦決議の改正についての連邦決議,关于修改促进住宅建设措施法令并延长其适用期的联邦法令,"Решение парламента касательно продления срока действия новой редакции Решения парламента ""О мерах по поддержке жилищного строительства"".",القرار الفدرالي بشأن تمديد فترة سريان المرسوم الفدرالي الخاص بالتدابير الرامية لتشجيع بناء المساكن والتعديلات المرافقة
474,151,04/06/1950,Constitutional reform of the federal finances,Bundesbeschluss über die verfassungsmässige Neuordnung des Finanzhaushaltes des Bundes,Arrêté fédéral instituant de nouvelles dispositions constitutionnelles sur le régime financier de la Confédération,Decreto federale che istituisce nuove disposizioni costituzionali sull'ordinamento delle finanze della Confederazione,Decreto federal relativo a la introducción de nuevas disposiciones constitucionales sobre el régimen financiero federal,Resolução federal sobre a revisão constitucional do orçamento federal,国の財政に関する憲法上の新規定についての連邦決議,关于对联邦预算作宪法性修改的联邦法令,"Решение парламента ""О конституционно-правовых основах организации бюджета федерального центра"".",المرسوم الفدرالي بشأن الأحكام الدستورية الجديد المتعلقة بالموازنة المالية للكنفدرالية
473,152,01/10/1950,"""Protecting land and work by preventing speculation""",Eidgenössische Volksinitiative 'zum Schutz des Bodens und der Arbeit durch Verhinderung der Spekulation',Initiative populaire fédérales visant la «Protection du sol et du travail par des mesures contre la spéculation»,Iniziativa popolare per la protezione del suolo e del lavoro con provvedimenti contro la speculazione,Iniciativa popular federal «Por la protección del suelo y del trabajo con medidas contra la especulación»,"Iniciativa popular ""Proteção do território e do trabalho com medidas contra a especulação""",イニシアチブ「投機を阻止して土地と労働を保護」,公民动议《通过预防投机买卖来保护土地与工作》,"Народная законодательная инициатива ""О защите земли и труда посредством противодействия спекуляции"".","المبادرة الشعبية ""من أجل حماية الأرض والعمل من خلال إجراءات منع المضاربة"""
472,154,03/12/1950,Federal finances for 1951-1954,Bundesbeschluss über die Finanzordnung 1951 bis 1954,Arrêté fédéral concernant le régime financier de 1951 à 1954,Decreto federale concernente l'ordinamento finanziario dal 1951 al 1954,Decreto federal sobre el régimen financiero de 1951 a 1954,Resolução federal sobre o orçamento para o período 1951-1954,１９５１年から１９５４年までの財務規定に関する連邦決議,关于1951-1954年预算的联邦法令,"Решение парламента ""О порядке организации федеральных финансов на период с 1951 по 1954 гг."".",المرسوم الفدرالي بشأن النظام المالي من عام 1951 ولغاية 1954
471,153,03/12/1950,Constitutional amendment on election to the House of Representatives,Bundesbeschluss betreffend Abänderung des Artikels 72 der Bundesverfassung (Wahl des Nationalrates),Arrêté fédéral modifiant l'article 72 de la constitution (élection du Conseil national),Decreto federale concernente la modificazione dell'articolo 72 della Costituzione federale (Elezione del Consiglio nazionale),Decreto federal sobre la modificación del artículo 72 de la Constitución federal (Elección del Consejo Nacional),Resolução federal referente à emenda do artigo 72 da Constituição Federal (eleição do Conselho Nacional),連邦憲法７２条の改正に関する連邦決議（下院選挙）,关于修订联邦宪法第72条的联邦法令(瑞士国会选举),Решение парламента касательно внесения изменений в Ст. 72 Федеральной конституции (выборы депутатов Национального совета).,المرسوم الفدرالي بشأن تعديل المادة 72 من الدستور الفدرالي (انتخاب المجلس الوطني)
470,155,25/02/1951,Transport of persons and goods by motorised transport on public roads,Bundesbeschluss über den Transport von Personen und Sachen mit Motorfahrzeugen auf öffentlichen Strassen (Autotransportordnung),Arrêté fédéral concernant le transport sur la voie publique de personnes et de choses au moyen de véhicules automobiles,Decreto federale concernente gli autotrasporti di persone e di cose sulle strade pubbliche (Ordinamento degli autotrasporti),Decreto federal sobre el transporte de personas y cosas con automóviles en vías públicas (Reglamento del transporte automóvil),Resolução federal sobre o transporte de passageiros e mercadorias por meio de transporte motorizado nas estradas públicas,公道での自動車両による人と貨物の輸送に関する連邦決議（自動車輸送規定）,关于机动车辆利用公路运送人员与商品的联邦法令,"Решение парламента ""О порядке транспортировки людей и грузов моторизованными средствами передвижения по общественным дорогам ""(Autotransportordnung).",المرسوم الفدرالي بشأن نقل الأشخاص والبضائع على الطرق العامة بواسطة وسائل النقل الآلية
469,156,15/04/1951,"Counter-proposal to the people's initiative ""Guarantee of purchasing power and full employment""",Gegenvorschlag zur eidgenössischen Volksinitiative zur Sicherstellung der Kaufkraft und Vollbeschäftigung (Freigeldinitiative),Contre-projet à l'initiative populaire concernant la revision de l'art. 39 de la constitution (initiative pour la monnaie franche),,Contrapropuesta a la iniciativa popular federal por una garantía del poder adquisitivo y del pleno empleo (Emisión de billetes de banco),"Contraproposta à iniciativa popular ""Guarantia de poder de compra e pleno emprego""",購買力と完全雇用の確立を求める全国イニシアチブへの対案（自由貨幣イニシアチブ）,针对公民动议《保证购买力与充分就业》的反提案,"Контрпредложение к Народной законодательной инициативе ""О порядке обеспечения покупательной способности населения (Freigeldinitiative)"".","المقترح المضاد للمبادرة الشعبية ""من أجل ضمان القدرة الشرائية والتوظيف الكامل"""
468,156,15/04/1951,Constitutional amendment guarantee of purchasing power and full employment,Bundesbeschluss über das Volksbegehren betreffend die Revision des Artikels 39 der Bundesverfassung (Freigeldinitiative),Arrêté fédéral sur l'initiative populaire fédérales concernant la révision de l'art. 39 de la constitution (initiative pour la monnaie franche),Decreto Federale che accerta il risultato della votazione popolare del 15 aprile 1951 sulla revisione dell articolo 39 della Costituzione federale (Emissione dei biglietti di banca),Decreto federal relativo a la iniciativa popular sobre la revisión del artículo 39 de la Constitución federal (Emisión de billetes de banco),"Resolução federal sobre a iniciativa popular referente a revisão do artigo 39 da Constituição Federal (""Guarantia de poder de compra e pleno emprego"")",連邦憲法３９条改正に関する国民発案についての連邦決議（自由貨幣イニシアチブ）,公民动议《保证购买力与充分就业》,"Решение парламента ""О Народной законодательной инициативе касательно пересмотра Ст. 39 федеральной конституции (обеспечение покупательной способности населения)"".",المرسوم الفدرالي بشأن المبادرة الشعبية المتعلقة بمراجعة المادة 39 من الدستور الفدرالي
467,157,08/07/1951,"""Taxation of public enterprises for the benefit of national defence""",Eidgenössische Volksinitiative 'zur Heranziehung der öffentlichen Unternehmungen zu einem Beitrag an die Kosten der Landesverteidigung',Initiative populaire fédérale concernant la «Participation des entreprises de droit public aux dépenses pour la défense nationale»,Iniziativa popolare per 'la partecipazione delle imprese di diritto pubblico alle spese per la difesa nazionale',Iniciativa popular federal «Por la participación de las empresas públicas en los gastos para la defensa nacional»,"Iniciativa popular ""Empresas públicas também devem contribuir para os custos com defesa nacional""",イニシアチブ「国防費は公営企業も負担を」,公民动议《为国防利益对公营企业课税》,"Народная законодательная инициатива ""О привлечении государственных и общественных фирм и предприятий к финансированию оборонных проектов"".","المبادرة الشعبية ""مشاركة المؤسسات العامة في نفقات الدفاع الوطني"""
466,158,02/03/1952,Maintain requirement for licence to open or extend restaurants,Bundesbeschluss betreffend Verlängerung der Geltungsdauer des Bundesbeschlusses über die Bewilligungspflicht für die Eröffnung und Erweiterung von Gasthöfen,Arrêté fédéral prorogeant celui qui restreint l'ouverture et l'agrandissement d'hôtels,Decreto federale che proroga quello che limita l'apertura e l'ampliamento degli alberghi,Decreto federal que prorroga otro que limita la apertura y ampliación de hostales,Resolução federal que prorroga a validade da resolução federal sobre a necessidade de aprovação oficial para abrir ou ampliar hotéis,宿屋の開業および拡張時の認可申請義務に関する連邦決議の有効期限延長についての連邦決議,关于对旅馆开办与扩建批准条件联邦法令的适用期作延长的联邦法令,"Решение парламента касательно продления срока действия Решения парламента ""О порядке получения разрешения на открытие и расширение постоялых дворов"".",المرسوم الفدرالي بشأن تمديد فترة تطبيق المرسوم الفدرالي حول اشتراط الحصول على ترخيص لافتتاح الفنادق الصغيرة وتوسيعها
465,159,30/03/1952,Promoting agriculture and supporting farmers (Agriculture law),Bundesgesetz über die Förderung der Landwirtschaft und die Erhaltung des Bauernstandes (Landwirtschaftsgesetz),Loi fédérale sur l'amélioration de l'agriculture et le maintien de la population paysanne (loi sur l'agriculture),Legge federale concernente il promovimento dell'agricoltura e la conservazione del ceto rurale (Legge sull'agricoltura),Ley federal sobre el fomento de la agricultura y el mantenimiento del campesinado (Ley sobre la agricultura),Lei federal sobre fomento para a agricultura e estabilização da população de agricultores (Lei agrícola),農業の促進および農民の地位の維持に関する連邦法（農業法）,关于促进农业与支持农民的联邦法(农业法),"ФЗ ""О поддержке сельского хозяйства и о сохранении крестьянского сословия"" (Landwirtschaftsgesetz).",القانون الفدرالي بشأن تشجيع الزراعة والحفاظ طبقة المزارعين (قانون الزراعة)
464,160,20/04/1952,"""Federal sales tax""",Volksbegehren betreffend die Umsatzsteuern,Initiative populaire fédérale concernant les «Impôts sur le chiffre d'affaires»,Iniziativa popolare concernente le imposte sulla cifra d'affari,Iniciativa popular relativa a los impuestos sobre la cifra de negocios,Iniciativa popular sobre o Imposto sobre circulação de mercadorias,売上税に関する国民発案,公民动议《联邦销售税》,Народная законодательная инициатива касательно налога с оборота.,المبادرة الشعبية حول ضرائب المبيعات
463,161,18/05/1952,"""Taxation for the national defence and social achievements""",Volksbegehren zur Rüstungsfinanzierung und zum Schutze der sozialen Errungenschaften,Initiative populaire fédérales «Pour le financement des armements et pour la sauvegarde des conquêtes sociales»,Iniziativa popolare concernente il finanziamento degli armamenti e la salvaguardia delle conquiste sociali,Iniciativa popular por la financiación del armamento y la salvaguardia de las conquistas sociales,"Iniciativa popular ""Para o financiamento de armamento e proteção das conquistas sociais""",軍備の財源確保と社会的財産の保護を求める国民発案,公民动议《为国防利益对公营企业课税》,"Народная законодательная инициатива ""О финансировании оборонных расходов и о защите социальных завоеваний"".",المبادرة الشعبية الداعية إلى تمويل السلاح وحماية المكاسب الإجتماعية
462,162,06/07/1952,Arms expenditure,Bundesbeschluss vom 28.03.1952 über die Deckung der Rüstungsausgaben,Arrêté fédéral sur la couverture des dépenses pour l'armement,Decreto federale del 28.03.1952 concernente la copertura delle spese per l'armamento,Decreto federal del 28.03.1952 sobre la cobertura de los gastos para el armamento,Resolução federal sobre como cobrir os gastos com armamentos,１９５２年３月２８日の軍備費用の填補に関する連邦決議,关于支付军费支出的联邦法令,"Решение парламента от 28.03.1952 г. ""О покрытии расходов на военные нужды"".",المرسوم الفدرالي لـ 28 مارس 1952 بشأن تغطية الإنفاق العسكري
461,164,05/10/1952,Creation of air-raid shelters in existing houses,Bundesbeschluss vom 28.03.1952 über den Einbau von Luftschutzräumen in bestehenden Häusern,Arrêté fédéral concernant la construction d'abris antiaériens dans les bâtiments existants,Decreto federale del 28.03.1952 concernente la costruzione di rifugi antiaerei negli edifici già esistenti,Decreto federal del 28.03.1952 sobre la construcción de refugios antiaéreos en los edificios ya existentes,Resolução federal sobre a criação de abrigos antiaéreos nos prédios já existentes,１９５２年３月２８日の既存の建物への防空壕設置に関する連邦決議,关于在现有住房中增建突袭掩体的联邦法令,"Решение парламента от 28.03.1952 г. ""О порядке оборудования бомбоубежищ в жилых домах"".",المرسوم الفدرالي لـ 28 مارس 1952 بشأن بناء الملاجئ في المباني القائمة
460,163,05/10/1952,"Amending rules on tobacco tax in the law on old age-, widows- and orphans insurance",Bundesgesetz vom 01.02.1952 betreffend die Abänderung von Bestimmungen über die fiskalische Belastung des Tabaks im Bundesgesetz über die Alters- und Hinterlassenenversicherung,Loi fédérale modifiant les dispositions relatives à l'imposition du tabac de la loi fédérale sur l'assurance-vieillesse et survivants,Legge federale dell'01.02.1952 che modifica talune disposizioni concernenti l'imposizione sul tabacco della legge federale sull'assicurazione per la vecchiaia e per i superstiti,Ley federal del 01.02.1952 que modifica las disposiciones relativas a la fiscalidad del tabaco de la ley federal sobre el seguro de vejez y superivientes,"Lei federal que modifica as disposições sobre o imposto sobre tabaco na lei federal sobre o seguro para idosos, viúvas/os e órfãos",老齢・遺族年金を定める連邦法の中のたばこ税に関する規定改正についての１９５２年２月１日議決の連邦法,关于修订养老遗属保险联邦法中的烟草税规定的联邦法,"ФЗ от 01.02.1952 касательно внесения изменений в ""Положение О фискальной нагрузке на табак"" в рамках ФЗ ""Об организации системы государственного пенсионного обеспечения по старости и нетрудоспособности"".",القانون الفدرالي لـ 1 فبراير 1952 بشأن تعديل الأحكام المتعلقة بالرسوم المفروضة على التبغ في القانون الفدرالي لصالح التأمين على الشيخوخة الباقين لعى قيد الحياة
459,166,23/11/1952,National provision of bread-making cereals,Bundesbeschluss vom 26.09.1952 über die Brotgetreideversorgung des Landes,Arrêté fédéral concernant le ravitaillement du pays en céréales panifiables,Decreto federale del 26.09.1952 concernente l'approvvigionamento del paese con cereali panificabili,Decreto federal del 26.09.1952 sobre el abastecimiento del país con cereales panificables,Resolução federal sobre o abastecimento nacional de cereais para panificação,国のパン用穀類供給に関する１９５２年９月２６日の連邦決議,关于国内主食谷物供给的联邦法令,"Решение парламента от 26.09.1952 г. ""Об основах системы снабжения населения столовым зерном/хлебом"".",المرسوم الفدرالي لـ 26 يونيو 1952 بشأن امدادات حبوب صناعة الخبز في البلاد
458,165,23/11/1952,Temporary continuation of limited price control,Bundesbeschluss vom 26.09.1952 über die befristete Weiterführung einer beschränkten Preiskontrolle,Arrêté fédéral sur le maintien temporaire d'un contrôle des prix réduit,Decreto federale del 26.09.1952 concernente il mantenimento temporaneo di un controllo ridotto dei prezzi,Decreto federal del 26.09.1952 sobre la continuación temporal del control limitado de los precios,Resolução federal sobre a prorrogação temporária do controle limitado de preços,１９５２年９月２６日の制限付き物価管理の期限付き継続に関する連邦決議,关于有限物价控制临时延长的联邦法令,"Решение парламента от 26.09.1952 г. ""Об очередном продлении временных мер в области контроля и надзора за процессами ценообразования"".",القانون الفدرالي لـ 26 سبتمبر 1952 بشأن الاستمرار المؤقت لمراقبة محدودة للأسعار
457,167,19/04/1953,Reform of law on postal services,Bundesgesetz vom 20.06.1952 über die Revision des Bundesgesetzes betreffend den Postverkehr,Loi fédérale concernant la revision de la loi fédérale sur le service des postes,Legge federale del 20.06.1952 che modifica la legge sul servizio delle poste,Ley federal del 20.06.1952 relativa a la revisión de la ley federal sobre el servicio de correos,Lei federal sobre a revisão da lei federal sobre os serviços postais,郵便に関する連邦法改正についての１９５２年６月２０日議決の連邦法,关于修改邮政服务联邦法的联邦法,"ФЗ от 20.06.1952 г. ""О пересмотре ФЗ касательно основ организации почтовых услуг"".",القانون الفدرالي لـ 20 يونيو 1952 بشأن مراجعة القانون الفدرالي للخدمات البريدية
456,169,06/12/1953,Constitutional amendment on protection of water from pollution,Bundesbeschluss vom 30.09.1953 über die Ergänzung der Bundesvefassung durch einen Artikel 24quater betreffend den Schutz der Gewässer gegen Verunreinigung,Arrêté fédéral introduisant dans la constitution un article 24quater sur la protection des eaux contre la pollution,Decreto federale del 30.09.1953 che inserisce nella Costituzione federale un articolo 24quater sulla protezione delle acque dall'inquinamento,Decreto federal del 30.09.1953 sobre la introducción en la Constitución federal de un artículo 24quater relativo a la protección de las aguas contra la contaminación,Resolução federal que introduz na Constituição Federal o artigo 24 referente à proteção da água contra a poluição,水域保護に関する２４条の４による連邦憲法の補足に関する１９５３年９月３０日の連邦決議,关于在联邦宪法中增加第24条，内容涉及保护水体不受污染的联邦法令,"Решение парламента от 30.09.1953 г. ""О внесении изменений в федеральную конституцию посредством Ст. 24quater касательно защиты вод от загрязнения"".",المرسوم الدستوري لـ 30 سبتمبر 1953 بشأن إضافة المادة 24(4) حول حماية المياه من التلوث للدستور الفدرالي
455,168,06/12/1953,Constitutional amendment on reorganisation of the federal budget,Bundesbeschluss vom 25.09.1953 über die verfassungsmässige Neuordnung des Finanzhaushaltes des Bundes,Arrêté fédéral instituant de nouvelles dispositions constitutionnelles sur le régime financier de la Confédération,Decreto federale del 25.09.1953 che istituisce nuove disposizioni costituzionali sull'ordinamento delle finanze della Confederazione,Decreto federal del 25.09.1953 sobre la introducción de nuevas disposiciones constitucionales relativas al régimen financiero federal,Resolução federal sobre a reorganização constitucional do orçamento federal,国の財政に関する憲法上の新規定についての１９５３年９月２５日の連邦決議,关于对联邦预算作宪法性重组的联邦法令,"Решение парламента от 25.09.1953 г. ""О конституционно-правовых основах бюджета федерального центра"".",المرسوم الفدرالي لـ 25 سبتمبر 1953 بشأن إعادة التنظيم الدستوري للموازنة المالية للكنفدرالية
454,171,20/06/1954,Special assistance for Swiss expatriates injured in the war,Bundesbeschluss vom 23.12.1953 über ausserordentliche Hilfeleistungen an kriegsgeschädigte Auslandschweizer,Arrêté fédéral concernant une aide extraordinaire aux Suisse de l'étranger victimes de la guerre,Decreto federale del 23.12.1953 concernente un aiuto straordinarion agli Svizzeri dell'estero vittime della guerra,Decreto federal del 23.12.1953 sobre una ayuda extraordinaria para los suizos del exterior víctimas de la guerra,Resolução federal sobre auxílio especial para suíços feridos na guerra que vivem no exterior,１９５３年１２月２３日の戦争被害にあった在外スイス人への特別援助に関する連邦決議,关于向在战争中受伤的瑞士侨民发放特别援助的联邦法令,"Решение парламента от 23.12.1953 г. ""Об оказании внеочередной и неотложной помощи швейцарцам, проживающим за рубежом и пострадавшим в результате военных действий"".",المرسوم الفدرالي لـ 23 ديسمبر 1953 بشأن تقديم المساعدات الإستثنائية للسويسريين المقيمين في الخارج المتضررين من الحرب
