,Number of Vote,Date of Votes,eng,ger,fre,ita,spa,por,jpn,chi,rus,ara
627,1,06/06/1848,General reform of constitution,Totalrevision vom 12. September 1848,Révision totale du 12 septembre 1848,Revisione totale del 12 settembre 1848,Revisión total del 12 de septiembre de 1848,Revisão total de 12.09.1848,1848年9月12日の全面改正,1848年9月12日的全面修订,О конституции в редакции 12 сентября 1848 года.,المراجعة الشاملة لـ 12 سبتمبر 1848
626,10,14/01/1866,Ban on lottery and games of chance,Verbot der Lotterie und Hasardspiele,Interdiction des loteries et jeux de hasard,Divieto delle lotterie,Prohibición de la lotería y de los juegos de azar,Proibição de loterias e jogos de azar,富くじ・賭博の禁止,禁止博彩和赌博,О запрете лотерей и азартных игр.,حَظر اليانصيب وألعاب الحظ
625,9,14/01/1866,Protection of intellectual property rights,Schutz des geistigen Eigentums,Protection de la propriété littéraire artistique et industrielle,Garanzia della proprietà delle opere artistiche e letterarie,Protección de la propiedad intelectual,Proteção dos direitos de propriedade intelectual,知的財産保護,保护知识产权,О защите прав интеллектуальной собственности.,حماية الملكية الفردية
624,8,14/01/1866,Exclusion of certain punishable offences,Ausschluss einzelner Strafarten,Interdiction de certains genres de peines,Esclusione di certe pene,Exclusión de cierto género de penas,Exclusão de certos tipos de pena,特定の刑罰の除斥,排除某些可惩罚的罪行,О некоторых видах юридического наказания.,استثناء بعض أنواع الجرائم الموجبة للعقوبة
623,6,14/01/1866,Right to vote on cantonal matters,Stimmrecht der Niedergelassenen in kantonalen Angelegenheiten,Droit de vote des Suisses établis en matière cantonale,Diritto di voto negli affari cantonali,Derecho de voto de los suizos residentes en asuntos cantonales,Direito de voto dos domiciliados em questões cantonais,外国人定住者の州レベルの投票権,移民对州事务的投票权,О праве голоса на уровне кантона для проживающих на территории данного кантона граждан другого кантона.,حق المقيمين السويسريين في التصويت بشأن المسائل المتعلقة بالكانتونات
622,4,14/01/1866,Right to vote on matters of the commune,Stimmrecht der Niedergelassenen in Gemeindesachen,Droit de vote des Suisses établis en matière communale,Diritto di voto negli affari comunali,Derecho de voto de los suizos residentes en asuntos municipales,Direito de voto dos domiciliados em questões municipais,外国人定住者の基礎自治体レベルの投票権,移民对地方事务的投票权,О праве голоса на уровне общины для проживающих на территории данной общины граждан другой общины.,حق المقيمين السويسريين في التصويت بشأن المسائل البلدية
621,3,14/01/1866,Equal resident rights for Jews and naturalised citizens,Gleichstellung der Bürger im Bezug auf Niederlassung und Gesezgebung,Egalité des citoyens au point de vue de l'établissement et de la législation,Uguaglianza degli ebrei e dei cittadini naturalizzati,Igualdad de los ciudadanos en relación con el establecimiento y la legislación,Igualdade de direitos em relação à permissão de residência e legislação,定住許可に関する市民の平等化と法規,对犹太人和入籍公民的平等居住权,О равенстве граждан в части их прав на переезд и на поселение за пределами своего кантона на территории другого кантона.,المساواة بين جميع المواطنين من حيث الإقامة والتشريعات
620,5,14/01/1866,Tax and civil rights for residents,Besteuerung und zivilrechtliche Verhältnisse der Niedergelassenen,Impôts et rapports civils des Suisses établis,Imposizione dei cittadini domiciliati,Impuestos y relaciones civiles de los suizos residentes,Impostos e direitos civis dos cidadãos domiciliados,外国人定住者の課税および民法上の扱い,移民的上税权和民权,О порядке налогообложения и регистрации актов гражданского состояния проживающих на территории данного кантона граждан другого кантона.,الضرائب والحقوق المدنية للسويسريين المقيمين في الكنفدرالية
619,2,14/01/1866,Fixing weights and measures,Mass und Gewicht,Poids et mesures,Pesi e misure,Pesos y medidas,Estabelecimento de pesos e medidas,寸法と重量,确定度量衡,Об урегулировании системы мер и весов.,المقاييس والأوزان
618,7,14/01/1866,Freedom of belief and religious practice,Glaubens- und Kultusfreiheit,Liberté de conscience et des cultes,Libertà di coscienza e di culto,Libertad de conciencia y de culto,Liberdade de crença e prática religiosa,信仰と文化の自由,信仰和宗教活动自由,О принципе свободы веры и культуры.,حرية العقيدة وممارسة الشعائر الدينية
617,11,12/05/1872,General reform of the constitution,Totalrevision,Révision totale,Revisione totale,Revisión total,Revisão total,全面改正,全面修订,Полный пересмотр федеральной конституции.,المراجعة الشاملة للدستور الفدرالي
616,12,19/04/1874,General reform of the consitution,Totalrevision,Révision totale,Revisione totale,Revisión total,Revisão total,全面改正,全面修订,Полный пересмотр федеральной конституции.,المراجعة الشاملة للدستور الفدرالي
615,14,23/05/1875,Law on political rights for Swiss citizens,Bundesgesez über die politische Stimmberechtigung der Schweizerbürger,Loi fédérale sur le droit de vote des citoyens suisses,Legge federale pel diritto di voto dei cittadini svizzeri,Ley federal sobre el derecho de voto de los ciudadanos suizos,Lei federal sobre os direitos eleitorais dos cidadãos suíços,スイス国民の参政権に関する連邦法,关于瑞士公民投票权的联邦法,"ФЗ ""О праве голоса для швейцарских граждан"".",القانون الفدرالي بشأن حق التصويت للمواطنين السويسريين
614,13,23/05/1875,Law on notification and registering of civil status and marriage,Bundesgesez betreffend Feststellung und Beurkundung des Zivilstandes und die Ehe,Loi fédérale concernant l'état civil la tenue des registres qui s'y rapportent et le mariage,Legge federale su gli atti dello stato civile e il matrimonio,Ley federal sobre el registro del estado civil y del matrimonio,Lei federal referente à identificação e certificação do estado civil e do matrimônio,戸籍上の身分の確定と登録および婚姻に関する連邦法,关于确定和记录公民身份与婚姻的联邦法,ФЗ касательно установления факта и заверения акта гражданского состояния и брака.,القانون الفدرالي بشأن تقرير وتسجيل الحالة المدنية والزواج
613,15,23/04/1876,Law on issuing and cashing of bank notes,Bundesgesez über die Ausgabe und Einlösung von Banknoten,Loi fédérale sur l'émission et le remboursement des billets de banque,Legge federale sull'emissione e il rimborso dei biglietti di banca,Ley federal sobre la emisión y el reembolso de billetes de banco,Lei federal sobre emissão e reembolso de notas bancárias,紙幣の発行と回収に関する連邦法,关于发行与兑现纸币的联邦法,"ФЗ ""Об праве на эмитирование и на утилизацию банковских казначейских билетов"".",القانون الفدرالي بشأن إصدار وتبادل الأوراق النقدية
612,16,09/07/1876,Law on tax for men unfit to serve in the army,Bundesgesez betreffend die Militärpflichtersatzsteuer,Loi fédérale sur la taxe d'exemption du service militaire,Legge federale sulla tassa d'esenzione del servizio militare,Ley federal sobre la tasa de exención del servicio militar,Lei federal sobre imposto sobre serviço militar alternativo,兵役義務代替税に関する連邦法,关于以上税代替兵役的联邦法,ФЗ касательно избежания обязятельной военной службы путем уплаты налога.,القانون الفدرالي بشأن ضريبة الإعفاء من الخدمة العسكرية (البدل النقدي)
611,18,21/10/1877,Law on tax for men unfit to serve in the army,Bundesgesez betreffend den Militärpflichtersaz,Loi fédérale sur la taxe d'exemption du service militaire,Legge federale sulla tassa d'esenzione del servizio militare,Ley federal sobre la tasa de exención del servicio militar,Lei federal sobre alternativa ao serviço militar,兵役義務代替に関する連邦法,关于以上税代替兵役的联邦法,ФЗ касательно условий избежания военной обязательной службы,القانون الفدرالي بشأن ضريبة الإعفاء من الخدمة العسكرية (البدل النقدي)
610,19,21/10/1877,Law on the political rights of residents and temporary resident and the loss of political rights of Swiss citizens,Bundesgesez betreffend die politischen Rechte der Niedergelassenen und Aufenthalter und den Verlust der politischen Rechte der Schweizerbürger,Loi fédérale concernant les droits politiques des Suisses établis et en séjour et la perte des droits politiques des citoyens suisses,Legge federale su i diritti politici degli Svizzeri,Ley federal sobre los derechos políticos de los residentes y estantes y la pérdida de los derechos políticos de los ciudadanos suizos,Lei federal sobre os direitos políticos dos domiciliados e residentes temporários e a perda de direitos políticos dos cidadãos suíços.,外国人定住者および滞在者の政治的権利並びにスイス人の政治的権利の喪失に関する連邦法,关于移民和临时居民的政治权利及瑞士公民丧失政治权利的联邦法,ФЗ касательно политических прав проживающих на территории одного кантона граждан другого кантона и об утрате политических прав швейцарскими гражданами.,القانون الفدرالي بشأن الحقوق السياسية للمقيمين وذوي الإقامة المؤقتة وحول فقدان المواطنين السويسريين للحقوق السياسية
609,17,21/10/1877,Law on factory work,Bundesgesez betreffend die Arbeit in den Fabriken,Loi fédérale concernant le travail dans les fabriques,Legge federale sul lavoro nelle fabbriche,Ley federal sobre el trabajo en las fábricas,Lei federal sobre o trabalho em fábricas,工場での労働に関する連邦法,关于工厂工作的联邦法,ФЗ касательно фабричной работы.,القانون الفدرالي بشأن العمل في المصانع
608,20,19/01/1879,Law on granting subsidies for Alpine railways,Bundesgesez betreffend Gewährung von Subsidien für Alpenbahnen,Loi fédérale accordant des subventions aux chemins de fer des Alpes,Legge federale sui sussidi per le ferrovie delle Alpi,Ley federal sobre la concesión de subsidios para las ferrovías alpinas,Lei federal sobre subsídio para as ferrovias alpinas,アルプス鉄道への助成金認可に関する連邦法,关于向阿尔卑斯铁路发放津贴的联邦法,ФЗ касательно предоставления субсидий альпийским железным дорогам.,القانون الفدرالي بشأن منح الدعم للسكك الحديدية في جبال الألب
607,21,18/05/1879,Constitutional amendment on lifting a ban on the death penalty,Bundesbeschluss betreffend Abänderung von Artikel 65 der Bundesverfassung (Todesstrafe),Loi fédérale concernant la révision de l'art. 65 de la Constitution fédérale (peine de mort),Risoluzione federale sulla modificazione dell'art. 65 della Costituzione federale (pena di morte),Decreto federal sobre la modificación del artículo 65 de la Constitución federal (Pena de muerte),Resolução federal sobre a emenda do artigo 65 da Constituição Federal (Pena de morte),連邦憲法６５条の改正に関する連邦決議（死刑）,关于修订联邦宪法第65条的联邦法令(死刑),Решение парламента касательно внесения изменений в Ст. 65 федеральной конституции (смертная казнь).,المرسوم الفدرالي بشأن تعديل المادة 65 من الدستور الفدرالي (عقوبة الأعدام)
606,22,31/10/1880,Constitutional amendment on the people's initiative for a revision of the constitution,Bundesbeschluss betreffend den durch das Volksbegehren vom 3. August 1880 gestellten Antrag auf Revision der Bundesverfassung,Arrêté fédéral concernant la proposition de révision de la constitution fédérale soulevée par l'initiative populaire en date du 3 août 1880,Risoluzione federale concernente la proposta di revisione della Costituzione avanzata per iniziativa popolare dal 3 agosto 1880,Decreto federal sobre la propuesta de revisión de la Constitución federal solicitada por la iniciativa popular del 3 de agosto de 1880,Resolução federal sobre a proposta da iniciativa popular de 03.08.1880 pela revisão da Constituição Federal,国民発案による連邦憲法改正に関する連邦決議,针对1880年8月3日要求修改联邦宪法的公民动议所作提案的联邦法令,"Решение парламента касательно ходатайства о пересмотре федеральной конституции, поданного в форме Народной законодательной инициативы от 3. 08. 1880 г.",المرسوم الفدرالي بشأن المراجعة الدستورية التي طالبت بها المبادرة الشعبية في 3 أغسطس 1880
605,24,30/07/1882,Law on measures to control dangerous epidemics,Bundesgesez betreffend Massnahmen gegen gemeingefährliche Epidemien,Loi fédérale concernant les mesures à prendre contre les épidémies offrant un danger général,Legge federale sulle epidemie,Ley federal sobre medidas contra las epidemias que constituyen un peligro público,Lei federal sobre medidas de combate a epidemias perigosas,法定伝染病対策に関する連邦法,关于应对危险传染病措施的联邦法,ФЗ касательно мер по борьбе с опасными эпидемиями.,القانون الفدرالي بشأن التدابير اللازمة لمكافحة الأوبئة التي تشكل خطراً على العامة
604,23,30/07/1882,Constitutional amendment on patent protection,Bundesbeschluss betreffend den Erfindungsschutz,Arrêté fédéral concernant une adjonction à introduire dans la constitution fédérale (protection des inventions),Risoluzione federale concernente un'aggiunta alla Costituzione federale (protezione delle invenzioni),Decreto federal relativo a la protección de los inventos,Resolução federal sobre a proteção de invenções,発明保護に関する連邦決議,关于保护发明的联邦法令,Решение парламента касательно защиты прав изобретателей.,المرسوم الفدرالي بشأن حماية الإختراعات
603,25,26/11/1882,Constitutional amendment on economic freedom,Bundesbeschluss betreffend die Vollziehung des Artikels 27 der Bundesverfassung (Unterrichtswesen),Arrêté fédéral concernant l'exécution de l'article 27 de la constitution fédérale (instruction primaire),Risoluzione federale concernente l'esecuzione dell'articolo 27 della Costituzione federale (istruzione primaria),Decreto federal sobre la ejecución del artículo 27 de la Constitución federal (Enseñanza primaria),Resolução federal sobre a prática do artigo 27 da Constituição Federal,連邦憲法２７条施行に関する連邦決議（教育制度）,关于执行联邦宪法第27条的联邦法令,Решение парламента касательно реализации положений Ст. 27 федеральной конституции (система образования).,المرسوم الفدرالي بشأن تنفيذ المادة 27 من الدستور (قطاع التعليم)
602,29,11/05/1884,"Constitutional amendment on CHF10,000 grant for chancellery of the Swiss embassy in Washington",Bundesbeschluss betreffend Gewährung eines Beitrags von 10'000 Franken an die Kanzleikosten der schweizerischen Gesandtschaft in Washington,Arrêté fédéral allouant une subvention de 10 000 francs à la légation suisse à Washington pour son secrétariat,Risoluzione federale concernente un sussidio alla legazione Svizzera a Washington,Decreto federal sobre la concesión de un subsidio de 10.000 francos a la legación suiza en Washington para gastos de secretaría,Resolução federal referente a um aporte de 10.000 francos para os gastos de chancelaria da Embaixada da Suíça em Washington,在ワシントンのスイス公使館事務費１万フラン拠出認可に関する連邦決議,关于向瑞士驻华盛顿大使馆发放一万瑞郎作其运营成本的联邦法令,Решение парламента касательно предоставления суммы в 10 тыс. франков на покрытие канцелярских расходов и расходов на делопроизводство швейцарской дипмиссии в Вашингтоне.,"المرسوم الفدرالي بشأن تخصيص مبلغ 10,000 فرنك لتغطية نفقات تشغيل السفارة السويسرية في واشنطن"
601,28,11/05/1884,Amendmed law on Swiss penal code,Bundesgesetz betreffend die Ergänzung des Bundesstrafrechtes vom 4. Februar 1853,Loi fédérale concernant l'adjonction d'un article au code pénal fédéral du 4 février 1853,Legge federale concernente l'aggiunto di un articolo al codice penale svizzero,Ley federal sobre la modificación del Código penal federal del 4 de febrero de 1853,"Lei federal que adiciona um artigo ao Código Penal Federal, de 04.02.1853",１８５３年２月４日議決の連邦刑法の補足に関する連邦法,关于补充1853年2月4日版联邦刑法的联邦法,ФЗ касательно внесения изменений в федеральное уголовное право в редакции от 04. 02. 1853 г.,القانون الفدرالي بشأن إتمام قانون العقوبات الفدرالي لـ 4 فبراير 1853
600,27,11/05/1884,Constitutional amendment on patent taxes for commercial travellers,Bundesbeschluss betreffend die Patenttaxen der Handelsreisenden,Arrêté fédéral concernant les taxes de patente des voyageurs de commerce,Risoluzione federale concernente le tasse per le patenti dei viaggiatori di commercio,Decreto federal relativo a las tasas para las patentes de los viajantes de comercio,Resolução federal sobre taxas de patente para viajantes comerciais,出張販売員の特許税に関する連邦決議,关于旅行推销员的专利税的联邦法令,Решение парламента касательно взимания оплаты за торговые патенты и порядка организации разъездной торговли.,المرسوم الفدرالي بشأن رسوم براءات الإختراع للباعة المتجولين
599,26,11/05/1884,Law on organisation of the Justice and Police Ministry,Bundesgesetz betreffend die Organisation des eidgenössischen Justiz- und Polizeidepartements,Loi fédérale concernant l'organisation du département fédéral de justice et police,Legge federale concernente l'organizzazione del Dipartimento di giustizia e polizia,Ley federal sobre la organización del Departamento Federal de Justicia y Policía,Lei federal referente à organização do Departamento Federal de Justiça e Polícia,連邦司法・警察省の組織に関する連邦法,关于联邦司法警察部组织结构的联邦法,ФЗ касательно организации Федерального департамента (министерства) юстиции и полиции.,القانون الفدرالي بشأن تنظيم وزارة العدل والشرطة الفدرالية
598,30,25/10/1885,Partial reform of the constitution,Bundesbeschluss betreffend teilweise Aenderung der Bundesverfassung der schweizerischen Eidgenossenschaft (Wirtschaftswesen und Alkoholfrage),Arrêté fédéral modifiant partiellement la constitution fédérale (auberge et alcool),Risoluzione federale sulla revisione della Costituzione federale (alberghi e alcool),Decreto federal sobre la modificación parcial de la Constitución de la Confederación Suiza (Hostales y alcohol),Resolução federal referente à revisão parcial da Constituição Federal,スイス連邦憲法の一部改正に関する連邦決議（経済制度およびアルコール問題）,关于联邦宪法部分修改的联邦法令,Решение парламента касательно внесения частичных изменений в федеральную конституцию (экономика и оборот алкогольной продукции).,المرسوم الفدرالي بشأن التعديل الجزئي للدستور الفدرالي (الفنادق الصغيرة والمشروبات الكحولية)
597,31,15/05/1887,Law on alcohol,Bundesgesetz betreffend gebrannte Wasser,Loi fédérale concernant les spiritueux,Legge federale sulle bevande spiritose,Ley federal sobre bebidas espirituosas,Lei federal sobre bebidas destiladas,蒸留酒に関する連邦法,关于烈性酒的联邦法,"ФЗ ""О продукции самогоноварения"".",القانون الفدرالي بشأن المشروبات الروحية
596,32,10/07/1887,Constitutional amendment on patent protection,Bundesbeschluss betreffend Ergänzung des Artikels 64 der Bundesverfassung vom 29. Mai 1874,Arrêté fédéral concernant un complément à l'article 64 de la constitution fédérale du 29 mai 1874,Modificazione dell'art. 64 della Costituzione federale (protezione delle invenzioni),Decreto federal sobre la modificación del artículo 64 de la Constitución federal del 29 de mayo de 1874,Resolução federal que modifica o artigo 64 da Constituição Federal de 29.05.1874,１８７４年５月２９日議決の連邦憲法６４条の補足に関する連邦決議,关于补充1874年5月29日版联邦宪法第64条的联邦法令,Решение парламента касательно внесения дополнений в Ст. 64 федеральной конституции в редакции от 29 мая 1874 г.,المرسوم الفدرالي بشأن استكمال المادة 64 من الدستور الفدرالي لـ 29 مايو 1874
595,33,17/11/1889,Law on prosecution of debt and bankruptcy,Bundesgesetz über Schuldbetreibung und Konkurs,Loi fédérale sur la poursuite pour dettes et la faillite,Legge federale sull'esecuzione e sul fallimento,Ley federal sobre la ejecución de deudas y quiebras,Lei federal sobre endividamento e falência,負債取り立ておよび倒産に関する連邦法,关于执行债务与倒闭的联邦法,"ФЗ ""О взимании долгов и о банкротстве"".",القانون الفدرالي بشأن تحصيل الديون والإفلاس
