,Number of Vote,Date of Votes,eng,ger,fre,ita,spa,por,jpn,chi,rus,ara
162,453,18/04/1999,Amended constitution,Bundesbeschluss über eine neue Bundesverfassung,Arrêté fédéral relatif à une mise à jour de la Constitution fédérale,Dectreto federale su una nuova Costituzione federale,Decreto federal sobre una nueva constitución federal,Resolução federal sobre uma nova Constituição federal,新しい連邦憲法に関する連邦決議,关于新联邦宪法的联邦法令,"Решение парламента ""О новой федеральной конституции""",المرسوم الفدرالي بشأن وضع دستور فدرالي جديد
161,458,13/06/1999,Law on insurance for motherhood,Bundesgesetz über die Mutterschaftsversicherung,Loi fédérale sur l'assurance-maternité,Legge federale sull'assicurazione per la maternità,Ley federal sobre el seguro por maternidad,Lei federal sobre o seguro/auxílio maternidade,女性の育児休業給付金制度に関する連邦法,关于母婴保险的联邦法,"ФЗ ""Об оплачиваемом отпуске по уходу за новорожденным ребенком"".",القانون الفدرالي بشأن التأمين على الأمومة
160,457,13/06/1999,Law on disability insurance,Bundesgesetz über die Invalidenversicherung,Loi fédérale sur l'assurance-invalidité (LAI),Legge federale sull'assicurazione per l'invalidità (LAI),Ley federal sobre el seguro de invalidez (LSI),Lei federal sobre a aposentadoria e seguro por invalidez,障害者保険に関する連邦法,关于伤残保险的联邦法,ФЗ о страховании по инвалидности.,القانون الفدرالي بشأن التأمين ضد العجز
159,456,13/06/1999,Prescription of heroin by doctors,Bundesbeschluss über die ärztliche Verschreibung von Heroin,Arrêté fédéral sur la prescription médicale d'héroïne,Decreto federale concernente la prescrizione medica di eroina,Decreto federal sobre la prescripción médica de heroína,Resolução federal sobre a prescrição médica de heroína,医師によるヘロイン処方に関する連邦決議,关于处方海洛因的联邦法令,"Решение парламента ""О праве медицинских работников прописывать употребление героина в лечебных целях"".",المرسوم الفدرالي بشأن تحرير الأطباء لوصفة الهيروين
158,455,13/06/1999,Urgent measures in relation to asylum-seekers and foreigners,Bundesbeschluss über dringliche Massnahmen im Asyl- und Ausländerbereich (BMA),Arrêté fédéral sur les mesures d'urgence dans le domaine de l'asile et des étrangers (AMU),Decreto federale concernente misure urgenti nell'ambito dell'asilo e degli stranieri (DMAS),Decreto federal sobre medidas urgentes en materia de asilo y extranjería (DMUA),Resolução federal sobre medidas urgentes em relação a pedidos de asilo e questões de estrangeiros,難民および外国人への緊急措置に関する連邦決議,关于难民和外国人紧急措施的联邦法令,"Решение парламента ""О первоочередных мерах по совершенствованию порядка предоставления убежища"" (BMA).",المرسوم الفدرالي بشأن اتخاذ تدابيرعاجلة فيما يتعلّق بطالبي اللجوء والأجانب
157,454,13/06/1999,Asylum law,Asylgesetz (AsylG),Loi sur l'asile (LAsi),Legge sull'asilo (LAsi),Ley sobre el asilo (LAsi),Lei de Asilo,難民法,难民法,"ФЗ ""О предоставлении убежища"" (AsylG).",قانون اللجوء
156,463,12/03/2000,"""Reducing motorised road traffic for to preserve and improve the environment (Traffic-halving initiative)""",Eidgenössische Volksinitiative 'für die Halbierung des motorisierten Strassenverkehrs zur Erhaltung und Verbesserung von Lebensräumen (Verkehrshalbierungs-Initiative)',Initiative populaire fédérale «Visant à réduire de moitié le trafic routier motorisé afin de maintenir et d'améliorer des espaces vitaux» (initiative pour la réduction du trafic),"Iniziativa popolare 'per il dimezzamento del traffico stradale motorizzato, allo scopo di salvaguardare e di migliorare gli spazi vitali (Iniziativa per dimezzare il traffico)'",Iniciativa popular federal «Por la reducción a la mitad del tráfico rodado motorizado para la conservación y la mejora de los espacios vitales (Iniciativa para reducir el tráfico a la mitad)»,"Iniciativa popular ""Pela diminuição de metade do tráfego motorizado para a preservação e melhoria dos espaços habitados""",イニシアチブ「生活圏の維持と改善のために車両交通量の半減を」（交通量半減イニシアチブ）,公民动议《为保护与改善生活空间而将道路交通流量减半》(交通减半动议),"Народная законодательная инициатива ""За снижение на 50% объемов моторизованного движения"".","المبادرة الشعبية ""خفض حركة المرور على الطرق المخصصة لوسائل النقل الآلي إلى النصف للحفاظ على مساحات المعيشة وتحسينها (مبادرة تقليص حركة المرور إلى النصف) """
155,462,12/03/2000,"""For the protection of people against abuses in reproductive technology (Initiative for humane reproduction)""",Eidgenössische Volksinitiative 'zum Schutze des Menschen vor Manipulationen in der Fortpflanzungstechnologie (Initiative für menschenwürdige Fortpflanzung [FMF])',Initiative populaire fédérale «Pour la protection de l'être humain contre les techniques de reproduction artificielle» (Initiative pour une procréation respectant la dignité humaine),Iniziativa popolare 'per la protezione dell'essere umano dalle manipolazioni nella tecnologia riproduttiva (Iniziativa per una riproduzione rispettosa della dignità umana [RRD])',Iniciativa popular federal «Por la protección de los hombres contra las técnicas de reproducción artificial (Iniciativa por una reproducción que respeta la dignidad humana [PRD])»,"Iniciativa popular ""Pela proteção das pessoas contra a manipulação através da tecnologia na medicina reprodutiva (Initiative pela reprocução humana)""",イニシアチブ「生殖技術の操作から人々を守るため」（尊厳ある生殖のためのイニシアチブ）,公民动议《要求保护人民，反对生殖技术操作》(人类繁殖动议),"Народная законодательная инициатива ""О защите от манипуляций в сфере репродуктивной медицины"".","المبادرة الشعبية ""من أجل حماية الشعب من التلاعب في مجال التكنولوجيا الإنجابية (مبادرة الإنجاب اللائق)"""
154,461,12/03/2000,"""For a fair representation of women in the federal authorities (Initiative of 3 March)""",Eidgenössische Volksinitiative 'für eine gerechte Vertretung der Frauen in den Bundesbehörden (Initiative 3. März)',Initiative populaire fédérale «Pour une représentation équitable des femmes dans les autorités fédérales» (Initiative du 3 mars),Iniziativa popolare federale 'per un'equa rappresentanza delle donne nelle autorità federali (Iniziativa 3 marzo)',Iniciativa popular federal «Por una representación justa de las mujeres en las autoridades federales (Iniciativa del 3 de marzo)»,"Iniciativa popular ""Por uma justa representação das mulheres nas autoridades federais (Initiativa de 3 de março)""",イニシアチブ「連邦官公庁で働く女性の数を公正に」,公民动议《要求联邦政府内女性的公平代表》(3月3日动议),"Народная законодательная инициатива ""За справедливое представительство женщин в федеральных органах власти"".","المبادرة الشعبية "" من أجل التمثيل العادل للنساء في السلطات الفدرالية (مبادرة 3 مارس)"""
153,460,12/03/2000,"""Speeding up direct democracy (Processing times for people's initiatives in the form of a specific draft)""",Eidgenössische Volksinitiative 'für Beschleunigung der direkten Demokratie (Behandlungsfristen für Volksinitiativen in Form eines ausgearbeiteten Entwurfs)',Initiative populaire fédérale «Pour une démocratie directe plus rapide» (Délai de traitement des initiatives populaires présentées sous forme de projet rédigé de toutes pièces),Iniziativa popolare 'per accelerare la democrazia diretta (termini di trattazione per le iniziative popolari in forma di progetto elaborato)',Iniciativa popular federal «Por una democracia directa más rápida (Plazos de tramitación para iniciativas populares presentadas en forma de proyectos elaborados)»,"Iniciativa popular ""Pela aceleração da democracia direta (prazo de processamento das iniciativas populares em forma de rascunho trabalhado)""",イニシアチブ「直接民主制の加速を」（イニシアチブを完成済みの草案とみなすことでそれを扱う期間に期限を設ける）,公民动议《要求加速直接民主(专门草案形式公民动议的处理时间)》,"Народная законодательная инициатива ""За ускорение процедур прямой демократии"".","المبادرة الشعبية ""من أجل تسريع الديمقراطية المباشرة"" (تحديد الفترات اللازمة لتجهيز المبادرات الشعبية بصيغة مشروع محدد)"
152,459,12/03/2000,Reform of the judiciary,Bundesbeschluss über die Reform der Justiz,Arrêté fédéral relatif à la réforme de la justice,Decreto federale sulla riforma giudiziaria,Decreto federal sobre la reforma de la justicia,Resolução federal sobre a reforma do judiciário,司法改革に関する連邦決議,关于司法制度改革的联邦法令,Решение парламента о реформировании системы юстиции.,المرسوم الفدرالي بشأن إصلاح النظام القضائي
151,464,21/05/2000,Sectoral agreements between Switzerland and the EU and/or its member states or Euratom,Bundesbeschluss über die Genehmigung der sektoriellen Abkommen zwischen der Schweizerischen Eidgenossenschaft einerseits und der Europäischen Gemeinschaft sowie gegebenenfalls ihren Mitgliedstaaten oder der Europäischen Atomgemeinschaft andererseits,Arrêté fédéral portant approbation des accords sectoriels entre d'une part la Confédération suisse et d'autre part la Communauté européenne ainsi que le cas échéant ses Etats membres ou la Communauté européenne de l'énergie atomique,Decreto federale che approva gli accordi settoriali fra la Confederazione Svizzera da una parte e la Comunità europea nonché eventualmente i suoi Stati membri o la Comunità europea dell'energia atomica dall'altra,"Decreto federal sobre la aprobación de los convenios sectoriales, por un lado, entre la Confederación Suiza y la Comunidad Europea, así como por el otro, llegado el caso, sus Estados miembros o la Comunidad Europea de la Energía Atómica",Resolução federal sobre acordos setoriais entre a Suíça e a Comunidade Europeia e/ou seus países membros ou a Comunidade Europeia da Energia Atômica,スイスと欧州共同体並びにその加盟国あるいは欧州原子力共同体間の部門別協定の承認に関する連邦決議,关于批准瑞士与欧盟委员会及/或其成员国或者欧洲原子能共同体间行业协议的联邦法令,"Решение парламента ""О введении в силу Первого пакета секторальных соглашений в ЕС"".","المرسوم الفدرالي بشأن المصادقة على الاتفاقيات القطاعية بين سويسرا من جهة والمجموعة الأوروبية والدول العضوة فيها في حالة الإقتضاء أو الجماعة الأوروبية للطاقة الذرية (يوراتوم) من جهة أخرى"""
150,468,24/09/2000,"""More citizens' rights through referendums with counter-proposals (Constructive referendum)""",Volksinitiative 'Mehr Rechte für das Volk dank dem Referendum mit Gegenvorschlag (Konstruktives Referendum)',Initiative populaire «Pour davantage de droits au peuple grâce au référendum avec contre-proposition (Référendum constructif)»,"Iniziativa popolare ""Più diritti per il Popolo grazie al referendum con controproposta (referendum propositivo)",Iniciativa popular federal «Más derechos para el pueblo gracias al referéndum con contrapropuesta (Referéndum constructivo)»,"Iniciativa popular ""Mais direitos para o povo graças ao referendo com contraproposta (Referendo construtivo)""",イニシアチブ「対案を伴うレファレンダムの導入で国民により大きい権利を」（建設的レファレンダム）,公民动议《借助有反提案的公民复决提高公民权》(建设性公民复决),"Народная законодательная инициатива ""Больше прав народу - за конструктивный референдум с контрпредложением"".","المبادرة الشعبية ""المزيد من الحقوق للشعب بفضل الاستفتاء مع المقترح المضاد (الاستفتاء البناء)"""
149,467,24/09/2000,"""For the regulation of immigration""",Volksinitiative 'für eine Regelung der Zuwanderung',Initiative populaire fédérale «Pour une réglementation de l'immigration»,"Iniziativa popolare ""per una regolamentazione dell'immigrazione""",Iniciativa popular federal «Por una reglamentación de la inmigración»,"Iniciativa popular ""Pelo controle da imigração""",イニシアチブ「移民の流入に規制を」,公民动议《要求实施移民管制》,"Народная законодательная инициатива ""О регулировании миграции"".","المبادرة الشعبية ""من أجل تنظيم الهجرة"""
148,465,24/09/2000,Counter-proposal to constitutional article on a levy to promote renewable energy),Gegenentwurf (Verfassungsartikel über eine Förderabgabe für erneuerbare Energien),Contre-projet (Article constitutionnel sur une redevance pour l'encouragement des énergies renouvelables),Articolo costituzionale sulla tassa di incentivazione sull'energia per l'ambiente (controprogetto concernente l'iniziativa 'energia e ambiente' che è stata ritirata),Contrapropuesta (Artículo constitucional sobre un impuesto para el fomento de las energías renovables),Contraproposta (Artigo constitucional sobre um fundo para promover energia renovável),対案（再生可能エネルギー促進税に関する憲法条項）,反提案(宪法中涉及为促进可更新能源征税的条文),Контрпредложение (статья конституции относительно финансирования возобновляемых источников энергии).,المقترح المضاد (المادة الدستورية حول فرض رسوم للترويج للطاقة المتجددة)
147,466,24/09/2000,"Environmental energy tax (Counter-proposal to the withdrawn iniative ""Energy environment"")",Verfassungsartikel über eine Energielenkungsabgabe für die Umwelt (Gegenentwurf zur zurückgezogenen 'Energie-Umwelt-Initiative'),Article constitutionnel sur une redevance incitative sur l'énergie en faveur de l'environnement (contre-projet à l'initiative ««Energie et environnement» qui a été retirée),Articolo costituzionale sulla tassa di incentivazione per le energie rinnovabili (controprogetto all'iniziativa popolare 'per l'introduzione di un centesimo solare [Iniziativa solare]'),Artículo constitucional sobre una tasa incitativa sobre la energía a favor del medio ambiente (contrapropuesta a la iniciativa «Energía y medio ambiente» que fue retirada),"Artigo constitucional sobre um imposto sobre energia para o meio ambiente (contraproposta à iniciativa ""Energia e meio ambiente"", retirada)",環境保護のためのエネルギー税に関する憲法条項（撤回済み「エネルギー・環境イニシアチブ」への対案）,宪法中涉及某环境能源税的条文(对撤销的《能源环境动议》的反提案),Проект изменений статьи Конституции относительно перекрестного финансирования проектов по защите окружающей среды.,"المادة الدستورية حول فرض ضريبة تحفيزية على الطاقة لصالح البيئة (المقترح المضاد لمبادرة ""الطاقة والبيئة"" التي تم سحبها)"
146,465,24/09/2000,"""For a 'solar centime' (Solar initiative)""",Volksinitiative 'für einen Solarrappen (Solar-Initiative)' und Gegenentwurf (Verfassungsartikel über eine Förderabgabe für erneuerbare Energien),Initiative populaire «Pour l'introduction d'un centime solaire (Initiative solaire)» et contre-projet (Article constitutionnel sur une redevance pour l'encouragement des énergies renouvelables),Iniziativa popolare 'per l'introduzione di un centesimo solare (Iniziativa solare),Iniciativa popular federal «Por la introducción de un céntimo solar (Iniciativa solar)» y contrapropuesta (Artículo constitucional sobre un impuesto para el fomento de las energías renovables),"Iniciativa popular ""Centavos pela energia solar (Iniciativa solar)""",イニシアチブ「ソーラー税」（ソーラー・イニシアチブ）と対案（再生可能エネルギー促進税に関する憲法条項）,公民动议《要求缴纳一分钱的“太阳能税”》(太阳能动议),"Народная законодательная инициатива ""За финансовую поддержку солнечной энергии"".","المبادرة الشعبية ""سنتيم من أجل الطاقة الشمسية (مبادرة الطاقة الشمسية)"" والمقترح المضاد (المادة الدستورية بشأن رسوم لتشجيع الطاقة المتجددة)"
145,473,26/11/2000,Law on federal employees,Bundespersonalgesetz (BPG),Loi sur le personnel de la Confédération (LPers),Legge sul personale federale (LPers),Ley sobre el personal federal (Lpers),Lei sobre funcionários federais,連邦公務員法,联邦公务员法,"ФЗ ""О служащих федеральных органов исполнительной власти"" (BPG).",قانون الموظفين الفدراليين
144,472,26/11/2000,"""For lower hospital costs""",Volksinitiative 'für tiefere Spitalkosten',Initiative populaire fédérale «Pour des coûts hospitaliers moins élevés»,Iniziativa popolare 'per costi ospedalieri più bassi',Iniciativa popular federal «Por la moderación de los costes hospitalarios»,"Iniciativa popular ""Por custos hospitalares mais baixos""",イニシアチブ「入院費の引き下げを」,公民动议《要求降低医院费用》,"Народная законодательная инициатива ""За понижение расходов на пребывание в стационаре"".","المبادرة الشعبية ""من أجل تخفيض تكاليف المستشفيات"""
143,471,26/11/2000,"""Saving on army and defence spending - for more peace and sustainable jobs (Redistribution initiative)""",Volksinitiative 'Sparen beim Militär und der Gesamtverteidigung - für mehr Frieden und zukunftsgerichtete Arbeitsplätze (Umverteilungsinitiative)',Initiative populaire «Economiser dans l'armée et la défense générale - pour davantage de paix et d'emplois d'avenir» (Initiative en faveur d'une redistribution des dépenses),Iniziativa popolare 'Risparmi nel settore militare e della difesa integrata - per più pace e posti di lavoro con un futuro (Iniziativa ridistributiva)',Iniciativa popular federal «Ahorrar en el ejército y en la defensa general - por más paz y más empleo de futuro (Iniciativa por la redistribución de los gastos)»,"Iniciativa popular ""Economizar gastos com o Exército e com defesa em geral - por mais paz e empregos mais voltados para o futuro (Iniciativa de redistribuição""",イニシアチブ「軍隊と総合防衛の経費削減―さらなる平和と未来志向の職場のために」（再分配イニシアチブ）,公民动议《节省军队国防支出-为了更多和平和放眼未来的工作岗位》(重分配动议),"Народная законодательная инициатива ""За уменьшение расходов на армию"".","المبادرة الشعبية ""الاقتصاد في نفقات الجيش والدفاع العام - للمزيد من السلام وفرص العمل المستقبلية (مبادرة إعادة توزيع النفقات)"""
142,470,26/11/2000,"""For a flexible retirement age for men and women over 62""",Volksinitiative 'für ein flexibles Rentenalter ab 62 für Frau und Mann',Initiative populaire fédérale «Pour une retraite à la carte dès 62 ans tant pour les femmes que pour les hommes»,Iniziativa popolare 'per un'età pensionabile flessibile: dai 62 anni per donne e uomini',"Iniciativa popular federal «Por una edad de jubilación flexible a partir de los 62 años, tanto para las mujeres como para los hombres»","Iniciativa popular ""Por um limite flexível de idade para aposentadoria a partir de 62 anos para homens e mulheres""",イニシアチブ「６２歳以上の男女に柔軟な定年年齢を」,公民动议《要求对62岁以上男性与女性放宽退休年龄限制》,"Народная законодательная инициатива ""За гибкий пенсионный возраст начиная с 62 лет для мужчин и женщин"".","المبادرة الشعبية ""من أجل سن تقاعد مرن اعتباراً من 62 عاما للرجال والنساء"""
141,469,26/11/2000,"""For a more flexible old age-, widows- and orphans insurance - Against raising the retirement age for women""",Volksinitiative 'für eine Flexibilisierung der AHV - gegen die Erhöhung des Rentenalters für Frauen',Initiative populaire «Pour un assouplissement de l'AVS - contre le relèvement de l'âge de la retraite des femmes»,Iniziativa popolare 'a favore di un'AVS flessibile - contro l'aumento dell'età di pensionamento per le donne',Iniciativa popular federal «Por una flexibilización del SVS - contra el aumento de la edad de jubilación de las mujeres»,"Iniciativa popular ""Por mais flexibilidade para as aposentadorias - contra o aumento da idade de aposentadoria para mulheres""",イニシアチブ「老齢・遺族年金の柔軟化を―女性の定年年齢引き上げに反対」,公民动议《要求更宽松的养老遗属保险-反对提高女性退休年龄》,"Народная законодательная инициатива ""Против повышения пенсионного возраста для женщин"".","المبادرة الشعبية ""من أجل توخي المرونة في التأمين على الشيخوخة والباقين على قيد الحياة - ضد رفع سن التقاعد للمرأة"""
140,476,04/03/2001,"""For greater traffic safety based on a speed limit of 30kph in built-up areas with exceptions (Roads for everyone)""",Eidgenössische Volksinitiative 'für mehr Verkehrssicherheit durch Tempo 30 innerorts mit Ausnahmen (Strassen für alle)',Initiative populaire fédérale «Pour plus de sécurité à l'intérieur des localités grâce à une vitesse maximale de 30 km/h assortie d'exceptions (Rues pour tous)»,"Iniziativa popolare 'per una maggior sicurezza stradale grazie alla velocità massima dei 30 km/h nelle località, con eccezioni (Strade per tutti)'",Iniciativa popular federal «Por más seguridad dentro de las poblaciones gracias a una velocidad máxima de 30 km/h con excepciones (Calles para todos)»,"Iniciativa popular ""Por mais segurança no trânsito através da redução do limite de velocidade para 30 km/h dentro da cidade - com exceções (Ruas para todos)""",イニシアチブ「例外つきで市街地の走行速度３０キロ制限を導入し安全な交通を」,公民动议《要求在大部分城区设立30公里时限速，以改善交通安全》(道路为人人),"Народная законодательная инициатива ""О введении скоростного ограничения в 30 км/ч в границах населенных пунктов"".","المبادرة الشعبية ""من أجل المزيد من السلامة المرورية بوضع حد أقصى للسرعة لا يزيد عن 30 كم/ساعة في المناطق العمرانية مع بعض الاستثناءات (الطرق للجميع)"""
139,475,04/03/2001,"""For lower-priced medication""",Eidgenössische Volksinitiative 'für tiefere Arzneimittelpreise',Initiative populaire fédérale 'pour des médicaments à moindre prix»,Iniziativa popolare 'Per farmaci a prezzi più bassi',Iniciativa popular «Por medicamentos menos caros»,"Iniciativa populPor medicamentos mais baratos""",イニシアチブ「医薬品の値下げを」,公民动议《要求廉价药物》,"Народная законодательная инициатива ""За низкие цены на лекарства"".","المبادرة الشعبية ""من أجل خفض تكاليف الأدوية والعقاقير الطبية """
